{
  "schemaVersion": "v2-px-real-chrome-evidence/2",
  "mode": "real_chrome",
  "automationMode": "headless_new",
  "chromeVersion": "151.0.7922.174",
  "extensionId": "aaaaaaaaaaaaaaaaaaaaaaaaaaaaaaaa",
  "extensionVersion": "0.1.0",
  "buildDigest": "aaaaaaaaaaaaaaaaaaaaaaaaaaaaaaaaaaaaaaaaaaaaaaaaaaaaaaaaaaaaaaaa",
  "commitSha": "aaaaaaaaaaaaaaaaaaaaaaaaaaaaaaaaaaaaaaaa",
  "routeId": "px-route-evidence00000001",
  "pageUrls": ["chrome-extension://aaaaaaaaaaaaaaaaaaaaaaaaaaaaaaaa/sidepanel.html", "chrome-extension://aaaaaaaaaaaaaaaaaaaaaaaaaaaaaaaa/workspace.html"],
  "viewports": [{ "width": 360, "height": 720 }, { "width": 420, "height": 800 }, { "width": 768, "height": 900 }, { "width": 1280, "height": 900 }],
  "screenshots": [
    { "path": "sidepanel-360.png", "sha256": "aaaaaaaaaaaaaaaaaaaaaaaaaaaaaaaaaaaaaaaaaaaaaaaaaaaaaaaaaaaaaaaa", "capturedAt": "2026-08-28T00:00:00.000Z", "container": "sidepanel", "viewport": { "width": 360, "height": 720 }, "imageContentSizePixels": { "width": 360, "height": 720 }, "rootHorizontalOverflowPx": 0, "routeId": "px-route-evidence00000001" },
    { "path": "sidepanel-420.png", "sha256": "bbbbbbbbbbbbbbbbbbbbbbbbbbbbbbbbbbbbbbbbbbbbbbbbbbbbbbbbbbbbbbbb", "capturedAt": "2026-08-28T00:00:01.000Z", "container": "sidepanel", "viewport": { "width": 420, "height": 800 }, "imageContentSizePixels": { "width": 420, "height": 800 }, "rootHorizontalOverflowPx": 0, "routeId": "px-route-evidence00000001" },
    { "path": "workspace-768.png", "sha256": "cccccccccccccccccccccccccccccccccccccccccccccccccccccccccccccccc", "capturedAt": "2026-08-28T00:00:02.000Z", "container": "workspace_page", "viewport": { "width": 768, "height": 900 }, "imageContentSizePixels": { "width": 768, "height": 900 }, "rootHorizontalOverflowPx": 0, "routeId": "px-route-evidence00000001" },
    { "path": "workspace-1280.png", "sha256": "dddddddddddddddddddddddddddddddddddddddddddddddddddddddddddddddd", "capturedAt": "2026-08-28T00:00:03.000Z", "container": "workspace_page", "viewport": { "width": 1280, "height": 900 }, "imageContentSizePixels": { "width": 1280, "height": 900 }, "rootHorizontalOverflowPx": 0, "routeId": "px-route-evidence00000001" }
  ],
  "traceRefs": [{ "path": "trace.json", "sha256": "eeeeeeeeeeeeeeeeeeeeeeeeeeeeeeeeeeeeeeeeeeeeeeeeeeeeeeeeeeeeeeee" }],
  "networkRef": { "path": "network.json", "sha256": "ffffffffffffffffffffffffffffffffffffffffffffffffffffffffffffffff" },
  "consoleRef": { "path": "console.json", "sha256": "abababababababababababababababababababababababababababababababab" }
}
